,flag,node
67,4.3.13,当阅览室(区)设置老年人及残障读者的专用座席时，应邻近管理台布置。在管理台附近设置老年人及残障人员专用座位，便于就近服务。4.4检索和出纳空间
68,4.3.14,阅览室每座所占使用面积设计计算指标应符合本规范附录B的规定。4.4检索和出纳空间
69,4.4.1,目录检索宜包括在线公共目录查询系统、书本目录和卡片目录等检索方式，可根据实际需要确定。当前，许多图书馆的目录检索都采用了在线公共目录查询系统，这种检索方式不仅可以查找本馆的文献资料，还可以在网上查找其他图书馆的资料。但在线公共目录查询系统目前尚不能完全取代卡片目录和书本目录，故需根据各图书馆的实际情况确定。
70,4.4.2,目录检索空间宜靠近读者出入口，并应与出纳空间相毗邻，检索设施可分散设置。当目录检索与出纳共处同一空间时，应有明确的分区。目录检索空间的位置与出纳空间毗邻是为了便于读者查询和借阅图书。采用在线公共目录查询系统时，既可以集中布置，也可以分散布置。
71,4.4.3,目录检索空间内目录柜的排列最小间距应符合表4.4.3的规定。表4.4.3目录柜排列最小间距(m)布置形式使用方式净距通道净宽目录台之间目录柜与查目台之间目录柜之间端头走廊中间通道目录台放置目录盒立式1.200.600.601.40坐式1.500.601.40续表4.4.3布置形式使用方式净距通道净宽目录台之间目录柜与查目台之间目录柜之间端头走廊中间通道目录柜之间设查目录台立式1.200.601.40坐式1.500.601.40目录柜使用抽拉板立式1.800.601.40
72,4.4.4,目录柜供成人使用时，高度不宜大于1.50m;供少年儿童使用时，高度不宜大于1.30m。采用坐式目录台检索时，应满足现行国家标准《无障碍设计规范》GB50763低位服务设施的要求。
73,4.4.5,"目录检索空间内采用计算机检索时，每台计算机所占使用面积应按2m²计算。坐式计算机检索台的高度宜为0.70m~0.75m,立式计算机检索台的高度宜为1.05m～1.10m。坐式计算机检索台的高度考虑了乘轮椅读者使用的需要，并与《无障碍设计规范》GB50763的规定相协调。"
74,4.4.6,"中心出纳台(总出纳台)应毗邻基本书库设置。出纳台与基本书库之间的通道不应设置踏步；当高差不可避免时，应采用坡度不大于1:8的坡道。书库通往出纳台的门应向出纳台方向开启，其净宽不应小于1.40m,并不应设置门槛，门外1.40m范围内应平坦、无障碍物。中心出纳台要求和书库靠近并连通，主要是为了提高工作效率，减轻工作人员的劳动强度。要求书库与出纳台之间不设踏步或设坡道，主要是为了便于书车通行，避免工作人员跌伤。"
75,4.4.7,"出纳空间应符合下列规定：1出纳台内的工作人员所占使用面积应按每一工作岗位不小于6m²计算；2当无水平传送设备时，工作区的进深不宜小于4m;当有水平传送设备时，应满足设备安装的技术要求；3出纳台外的读者活动面积，应按按出纳台内每一工作岗位所占使用面积的1.2倍计算，且不应小于18m²;出纳台前应保持进深不小于3m的读者活动区；4出纳台宽度不应小于0.60m。出纳台长度应按每一工作岗位1.50m计算。出纳台兼有咨询、监控等多种服务功能时，应按工作岗位总数计算长度。出纳台的高度宜为0.70m~0.85m。4.5公共活动和辅助服务空间出纳台内为出纳工作人员活动的空间，除办理借还手续外，还有联系书库的通道(人行和书车通行)和暂时存放常用书的书架、运书车、办公桌和放书袋卡的柜子(或旋盘)等。出纳台内进深尺寸(含出纳台宽度在内)无水平传送设备情况时，一般需要4m,当有水平的传送设备时按工艺布局的实际需要尺寸确定。出纳台外为读者活动范围，办理借书、还书、咨询等手续。由于每个出纳人员的服务能力按柜台长度计算为1.50m左右，即相当于每次接待并排3个读者同时索书、提书、办理借书手续，在借、还书高峰时也不至于拥挤阻塞。经对不同规模各类图书馆的实例进行分析，规定出纳台前应保持不小于3m的深度，这个尺寸是按借书高峰时出纳台前等候借还书的读者的需要确定。出纳台长度根据一个工作人员双臂在台面上的活动范围确定。4.5公共活动和辅助服务空间"
76,4.5.1,公共活动和辅助服务空间包括门厅、办证处、寄存处、陈列厅、培训场所、读者休息处、咨询服务处及报告厅等，可根据图书馆的性质、规模及实际需要确定。
77,4.5.2,门厅应符合下列规定：1应根据管理和服务的需要设置验证、咨询、收发、寄存和门禁监控等功能设施；2多雨地区，门厅内应设置存放雨具的设施；3严寒地区门厅应设门斗或采取其他防寒措施，寒冷地区门厅宜设门斗或采取其他防寒措施。
78,4.5.3,寄存处应靠近读者出入口，存物柜数量可按阅览座位的25%确定，每个存物柜的使用面积应按0.15m²~0.20m²计算。本条规定根据上海图书馆和国家图书馆的使用情况，对存物柜数量和每个存物柜占用的面积计算确定出的设计参数。
79,4.5.4,陈列厅应符合下列规定：1图书馆应设陈列空间，并可根据图书馆的规模、使用要求分别设置新书陈列厅、专题陈列厅或书刊图片展览厅；2门厅、读者休息处、走廊兼作陈列厅时，不应影响交通组织和安全疏散；3陈列厅宜采光均匀，并应防止阳光直射和眩光。图书馆陈列厅具有向读者推荐新书、介绍最新科学技术、展示艺术作品等功能。陈列厅设计需注意以下几点：1需设置在读者经常通过或逗留的地方，以吸引更多读者的注意。2避免陈列场所产生的噪声影响阅览。3考虑展示墙面的延续性和避免阳光直射，采光均匀。
80,4.5.5,报告厅应符合下列规定：1超过300座规模的报告厅应独立设置，并应与阅览区隔离；2报告厅与阅览区毗邻设置时，应设单独对外出入口；3报告厅宜设休息区、接待室及厕所；4报告厅应设置无障碍轮椅席位。图书馆报告厅主要为了进行图书宣传、阅览辅导、培训、会议、举办各类学术活动之用。这类场所由于人员集中，安全性能要求高，应和阅览区有一定的距离或进行分隔。当超过300座时，报告厅需与阅览区分开设置，以避免干扰。报告厅要求设单独出入口，以便于对外单独使用。4.6行政办公、业务及技术设备用房
81,4.5.6,图书馆的公共活动空间或辅助服务空间内应设置饮水供应设施。
82,4.5.7,供读者使用的厕所卫生洁具应按男女座位数各50%计算，卫生洁具数量应符合现行行业标准《城市公共厕所设计标准》CJJ14的规定。4.6行政办公、业务及技术设备用房
83,4.6.1,图书馆行政办公用房包括行政管理和后勤保障用房，其规模应根据使用要求确定，可组合在建筑中，也可单独设置。行政办公用房的建筑设计应按现行行业标准《办公建筑设计规范》JGJ67的有关规定执行。
84,4.6.2,图书馆的业务用房宜设置采编、典藏、辅导、咨询、研究、信息处理、美工等用房。技术设备用房宜设置电子计算机、缩微、照相、静电复印、音像控制、装裱修复、消毒等用房。
85,4.6.3,采编用房应符合下列规定：1应与读者活动区分开，并应与典藏室、书库、书刊入口有便捷联系；2平面布置应满足采购、交换、拆包、验收、登记、分类、编目和加工等工艺流程的要求；3拆包间应邻近工作人员入口或专设的书刊入口，进书量大的拆包间入口处应设卸货平台；4工作人员的人均使用面积不宜小于10m²。采编用房是图书馆业务用房的重要组成部分。由于它要进行一系列的新书编目加工工作，所以需要比较安静的环境，所在位置需与读者活动区分开或设门分隔。由于经常有大量新书进馆，经过编目加工之后通过典藏或直接入库，所以它尽可能设在底层并和书库有方便的水平、垂直运输联系，以减轻工作人员的劳动强度。采编工作有其固定的工艺流程，包括采购、交换、拆包、验收、登录、分类、编目、加工等程序。实践证明，采用一种大空间的布局形式比较适应采编用房的特点。进书量大的图书馆需专设拆包间，并设门直通室外。如室内外高差较大时，门口应设卸货平台。
86,4.6.4,"典藏室应符合下列规定：1当单独设置典藏室时，应位于基本书库的入口附近；2工作人员的人均使用面积不宜小于6m²,且房间的最小使用面积不宜小于15m²。典藏是将加工完毕的书刊进行分配的地方，图书的进出数量多、频率高，占用的空间较大，因而典藏用房需保证一定的工作面积。"
87,4.6.5,图书馆建筑设计可根据其业务需要，设置专题咨询和业务辅导用房，并应符合下列规定：1专题咨询和业务辅导工作人员的人均使用面积不宜小于6m²;2业务辅导用房应包括业务资料编辑室和业务资料阅览室；3业务资料编辑工作人员的人均使用面积不宜小于8m²;4业务资料阅览室可按8座～10座位设置，每座所占使用面积不宜小于3.50m²;5公共图书馆的咨询和业务辅导用房，宜分别配备不小于15m²的接待室。承担专题咨询和业务辅导任务的图书馆日常接待工作较多，尽可能靠近各自的办公室，单独设置一个接待空间。
88,4.6.6,图书馆信息处理等业务用房的工作人员人均使用面积不宜小于6m²。随着计算机技术和通信技术的日益进步，图书馆已成为信息收集、处理、输送、服务的重要场所。信息的采集、加工不仅限于图书采购、编目，还包括索引、文摘等二次文献的生成工作。信息处理用房的面积可按每个工作人员使用面积6m²考虑。
89,4.6.7,系统网络机房不得与易燃易爆物存放场所毗邻，且机房设计应符合现行国家标准《电子信息系统机房设计规范》GB50174的规定。图书馆采用计算机网络系统日渐广泛，除用于读者服务外，还担负全馆的安全系统、设备运行管理系统和通信系统的管理，安全性要求高，故需远离易燃、易爆物存放场所。
90,4.6.8,缩微与照相用房应符合下列规定：1缩微复制用房宜单独设置，且其建筑设计应满足工艺流程和设备的操作要求；2缩微复制用房应有防尘、防振、防污染措施，室内应配置电源和给水、排水设施，并宜根据工艺要求对室内温度、湿度进行调节控制；当采用机械通风时，应有净化措施；3照相室宜设置摄影室、拷贝还原工作间、冲洗放大室和器材、药品储存间；4摄影室、拷贝还原工作间应防紫外线和可见光，门窗应设遮光措施，墙壁、顶棚不宜用白色反光材料饰面；5冲洗放大室的地面、工作柜面和墙裙应能防酸、碱腐蚀，门窗应设遮光措施，室内应配置给水、排水和通风换气设施；6应根据规模和使用要求分别设置胶片库和药品库。本条各款所作规定，都是考虑缩微、照相加工工艺提出的必要要求。文献数字化加工技术已经基本代替了缩微技术，中小型图书馆已不再承担缩微功能。
91,4.6.9,"音像视听室的控制室应符合下列规定：1幕前放映的控制室，其进深和净高均不应小于3m;2控制室的观察窗应视野开阔，兼作放映孔时，其窗口下沿距控制室地面应为0.85m,距视听室后部地面应大于2m;3幕后放映的反射式控制室，进深不应小于2.70m,地面宜采用活动地板。音像控制室采取幕前放映方式时，控制室设于观众厅的后部；采取幕后放映方式时，控制室设在观众厅的前部。两种放映方式的控制室位置有不同要求，如幕前放映方式要求控制室地面高出演播室后部地面不少于2m,是为了避免后部通道有人走动时不致遮挡光束；幕后放映方式的控制室，地平只略高于演播室地平(0.30～0.50)m即可满足要求。另外幕后放映方式，由放映机射出的影像是通过一个反光镜射到银幕上的，反光镜靠近后墙安放，与放映机之间需要按镜头焦距调整距离至少相距3m左右，故控制室的进深，不小于4m。由于音像控制室面积一般均较小，安放的设备较多，为了便于安装和维护，控制室的地面尽可能采用活动地板。"
92,4.6.10,"装裱、修整室应符合下列规定：1室内应光线充足、宽敞，并应配备机械通风装置；2应设置给水、排水设施和加热用的电源；3每工作岗位人均使用面积不应小于10m²,且房间的最小面积不应小于30m²。装，是指装订，主要用于报刊装订；裱，是指裱糊，主要用于字画、舆图的裱糊；修，是指修补，主要用于线装书的修补；整，是指整旧，主要用于对新旧精、平装书的修补整理。在大型图书馆中上述部门都应具备，但裱糊修补和装订整旧可分别或合并设置。一般图书馆只设装订修整室即可。"
93,4.6.11,"化学消毒室应符合下列规定：1消毒室面积不宜小于10m²,建筑构造应密封；2地面、墙面应易于清扫、冲洗，并应设置机械排风系统；3废水、废气的排放应符合国家现行有关标准的规定。当书籍采用化学方法进行消毒时，如杀虫药剂对人体无害，可在库内就地施放，否则必须在消毒室内操作。对所采用的容器严格要求密闭，防止药液呈气雾状外泄；消毒间需设机械排风，室内墙面、地面要易于清扫或冲洗。"
94,4.6.12,当采用物理方法杀虫灭菌时，其消毒装置可靠近中心(总)出纳台设置。当书籍采用物理方法进行消毒时，采取把读者归还的书刊送进一台设备，通过光照进行杀菌消毒；如采取灭菌室时，需注意不使光或射线外泄、渗透。5文献资料防护5.1一般规定
95,4.6.13,当图书馆设有卫星接收及微波通信系统时，应在其附近设置相应的机房。5文献资料防护5.1一般规定
96,5.1.1,防护内容应包括围护结构保温、隔热、温度和湿度要求、防水、防潮、防尘、防有害气体、防阳光直射和紫外线照射、防磁、防静电、防虫、防鼠、消毒和安全防范等。、5.1.2图书馆除纸质文献资料以外，还有大量的非书资料，诸如缩微胶卷(片)、录音、录像带、光盘、磁盘等，它们共同构成图书馆的文献资料。妥善保存这些文献资料，根据防护的对象不同，防护要求也不同，设计中应区别对待，采取切实可行的防护措施。5.2温湿度要求
97,5.1.2,各类书库的防护要求应根据图书馆的性质、规模、重要性及书库类型确定。5.2温湿度要求
98,5.2.1,书库的温湿度控制应根据其不同的要求进行设计，并应符合本规范第8.2节的有关规定。5.3防水和防潮书库的温湿度以低些为好，但要适度，否则有使纸张水分冻结而易受损的可能。同时考虑到工作人员和读者身体舒适等因素。高温对图书的危害尤为严重。其主要表现为：温度过高，会使纸张中原有的水分迅速蒸发而干燥发脆，抗折性和其他机械强度降低，加速纸张老化。因此，温度和相对湿度需控制在一定的范围之内。收藏珍善本图书及重要的音像资料、电子文献等资料的特藏书库，其保存环境的温、湿度及其变化，对图书资料的寿命有很大的影响。因此，特藏书库的温、湿度需控制在一定的范围之内。5.3防水和防潮
99,5.3.1,书库的室外场地应排水通畅，防止积水倒灌；室内应防止地面、墙身返潮，不得出现结露现象；屋面雨水宜采用有组织外排法，不得在屋面上直接放置水箱等蓄水设施。对书库来讲，围护结构内表面都不允许出现结露现象。在室内外温差较大的地区，书库围护结构需采取有效的保温和隔潮措施。屋面排水宜采用有组织外排法，避免排水管道从库内穿过，防止因管道渗漏产生后患。
100,5.3.2,书库底层地面基层应采用架空地面或其他防潮措施。书库底层地面采用填实铺设防潮层的具体做法很多，可根据地下水位的高低来考虑。采用架空地面防潮效果更为可靠，这是由于基层和库房地面之间隔开一定的空间，使潮气和地下水不能直接通过地面层渗入库内，从而取得较好的防潮效果。5.4防尘和防污染
101,5.3.3,当书库设于地下室时，不应跨越变形缝，且防水等级应为一级。5.4防尘和防污染
102,5.4.1,图书馆的环境绿化宜选择具有净化空气能力的树种。图书馆的庭园绿化对环境保护有积极的作用。绿色植物特别是树木，对烟灰、粉尘有明显的阻挡、过滤和吸附作用。
103,5.4.2,书库的楼、地面应坚实耐磨，墙面和顶棚应表面平整、不易积灰。、5.4.3书库防尘包括避免库内围护结构(主要是地面)起尘和防止库外灰尘的进入，因此书库的楼地面及墙面需选用光滑、平整、不易起尘的饰面材料。书库门窗需有良好的密闭性能，特藏书库对环境中的灰尘和有害气体的含量限制要求较高，灰尘和有害气体会严重损坏藏品。因此，需设固定窗，当设少量开启扇时，需采用密闭窗。5.5防日光直射和紫外线照射
104,5.4.3,书库的外门窗应有防尘的密闭措施。特藏书库应设固定窗，必要时可设少量开启窗扇。
105,5.4.4,锅炉房、除尘室、洗印暗室等用房应设置在对图书馆污染影响较少的部位，并应设置通风设施。5.5防日光直射和紫外线照射
106,5.5.1,天然采光的书库及阅览室应采取遮阳措施，防止阳光直射。利用透光材料的扩散和折射性能，不仅可减弱阳光对图书资料的直接危害，而且可消除室内的眩光。另外，利用遮阳构件、遮阳百叶、遮阳格片或窗帘进行调光、遮光，使用方便，操作也较灵活。5.6防磁和防静电
107,5.5.2,书库及阅览室均应采取消除或减轻紫外线对文献资料危害的措施。
108,5.5.3,珍善本书库及其阅览室的人工照明应采取防止紫外线的措施。5.6防磁和防静电
109,5.6.1,计算机房和数字资源储存区域应远离产生强磁干扰的设备，并应符合现行国家标准《电子信息系统机房设计规范》GB50174的规定。现在图书馆大量使用电子文献资料和电子设备，馆内的变压器、电动机、无线电装置及其他设备形成的磁场有可能对其产生影响，解决的办法是两者保持一定的距离，或采取屏蔽措施。
110,5.6.2,计算机房和数字资源储存区域的楼、地面应采用防静电的饰面材料。5.7防虫和防鼠图书馆内人员活动产生的静电，容易造成信号的失落、失真、杂波干扰以及信息的丢失等损害，因此，应选用防静电的饰面材料。5.7防虫和防鼠
111,5.7.1,图书馆的绿化应选择不滋生、引诱害虫的植物。据目前所知危害图书的害虫共有六个目30余种，如：缨尾目的毛衣鱼、蜚蠊目的东方蜚、齿虫目的书虱、等翅目的家白蚁、鞘翅目的花斑皮蠹、竹蠹、短鼻木象以及客居性鳞翅目的衣蛾等。庭园绿化所种植的植物以驱虫或杀虫植物为好，如皂角、樟树、除虫菊、百部、芸香等。另外还有些灭菌、防疫功能的植物，如丁香、柠檬、茉莉、米兰以及紫薇、野樱桃等。
112,5.7.2,书库外窗的开启扇应采取防蚊蝇的措施。采用可拆卸或可启闭的纱窗，便于无蚊蝇期卸下或开启纱窗，有利于书库天然采光。5.8安全防范
113,5.7.3,食堂、快餐室、食品小卖部等应远离书库布置。
114,5.7.4,鼠患地区宜采用金属门，门下沿与楼地面之间的缝隙不应大于5mm。墙身通风口应用金属网封罩。
115,5.7.5,白蚁危害地区，应对木质构件及木制品等采取白蚁防治措施。5.8安全防范
116,5.8.1,图书馆的主要出入口、特藏书库、开架阅览室、系统网络机房等场所应设安全防范装置。～
117,5.8.2,图书馆宜在各通道出入口设置出入口控制系统，并应按开放的时间、区域使用功能等需求设置安全防范系统。
118,5.8.3,位于底层及有入侵可能部位的外门窗应采取安全防范措施。
119,5.8.4,陈列和贮藏珍贵文献资料的房间应能单独锁闭，并应设置入侵报警系统。
120,5.8.5,图书馆的安全防范应符合现行国家标准《安全防范工程技术规范》GB50348的规定。6防火设计6.1耐火等级图书馆应根据规模、特点、重要性等因素进行安全防范设计，对于不同的设防部位，采取相应的防范措施。6防火设计6.1耐火等级
121,6.1.1,图书馆建筑防火设计除应执行本规范规定外，尚应符合现行国家标准《建筑设计防火规范》GB50016的有关规定。
122,6.1.2,藏书量超过100万册的高层图书馆、书库，建筑耐火等级应为一级。针对图书馆建筑的特殊性并结合现行国家标准《建筑设计防火规范》GB50016的有关规定加以制定。图书资料多为纸质文献，属于固体可燃品。藏书量超过100万册的高层图书馆、书库，藏书数量多，且火灾扑救难度大，一旦发生火灾，造成的损失难以补救。实施要点说明：各类建筑构件的燃烧性能和耐火极限应符合现行国家标准《建筑设计防火规范》GB50016对于一级耐火等级建筑的规定。
123,6.1.3,除藏书量超过100万册的高层图书馆、书库外的图书馆、书库，建筑耐火等级不应低于二级，特藏书库的建筑耐火等级应为一级。6.2防火分区及建筑构造除本规范第6.1.2条规定外的图书馆、书库，在综合考虑安全、经济等因素的前提下，其耐火等级按不应低于二级确定。同时也考虑到此类图书馆中可能存放一些特别珍贵的图书文献，因此提出对特藏书库的耐火等级应为一级。实施要点说明：各类建筑构件的燃烧性能和耐火极限应符合现行国家标准《建筑设计防火规范》GB50016对于不同耐火等级的建筑的规定。6.2防火分区及建筑构造
124,6.2.1,基本书库、特藏书库、密集书库与其毗邻的其他部位之间应采用防火墙和甲级防火门分隔。基本书库、特藏书库和密集书库均属于藏书空间。这些空间中存放有大量的书籍或珍贵的文献，应采取专门的防火保护措施，以阻止火灾向相邻区域蔓延，避免或减少火灾损失。因此，规定此类书库应用防火墙与其他部位隔离，当防火墙上开设洞口时，应设甲级防火门。实施要点说明：基本书库、特藏书库和密集书库的围护结构构件的耐火极限应符合现行国家标准《建筑设计防火规范》GB50016的有关规定，分隔墙体应达到防火墙的耐火极限要求，防火墙上开设的洞口应设甲级防火门。
125,6.2.2,"对于未设置自动灭火系统的一、二级耐火等级的基本书库、特藏书库、密集书库、开架书库的防火分区最大允许建筑面积，单层建筑不应大于1500m²;建筑高度不超过24m的多层建筑不应大于1200m²;高度超过24m的建筑不应大于1000m²;地下室或半地下室不应大于300m²。本条是对不同类型的书库的防火分区面积的限定。划分防火分区是为了有效控制火灾影响的范围，减少火灾损失。书库中储存物品的火灾危险性特征为“可燃固体”,其防火分区的划分与现行国家标准《建筑设计防火规范》GB50016的相关规定保持一致。实施要点说明：各种类型的书库，在不同的情况下，其防火分区面积应符合规范的规定；不同防火分区之间应采用防火墙、甲级防火门分隔。"
126,6.2.3,当防火分区设有自动灭火系统时，其允许最大建筑面积可按本规范规定增加1.0倍，当局部设置自动灭火系统时，增加面积可按该局部面积的1.0倍计算。
