,flag,node
0,文件信息,"UDCP中华人民共和国行业标准JGJ38-2015备案号J2081-2015图书馆建筑设计规范Codefordesignoflibrarybuildings2015-08-28发布2016-05-01实施中华人民共和国住房和城乡建设部发布中华人民共和国行业标准图书馆建筑设计规范CodefordesignoflibrarybuildingsJGJ38-2015批准部门：中华人民共和国住房和城乡建设部施行日期：2016年5月1日中国建筑工业出版社中华人民共和国住房和城乡建设部公告第907号住房城乡建设部关于发布行业标准《图书馆建筑设计规范》的公告现批准《图书馆建筑设计规范》为行业标准，编号为JGJ38-2015,自2016年5月1日起实施。其中，第6.1.2、6.1.3、6.2.1、6.2.2条为强制性条文，必须严格执行。原《图书馆建筑设计规范》JGJ38-99同时废止。本规范由我部标准定额研究所组织中国建筑工业出版社出版发行。中华人民共和国住房和城乡建设部2015年8月28日前言根据住房和城乡建设部《关于印发〈2009年工程建设标准规范制订、修订计划〉的通知》(建标[2009]88号)的要求，规范编制组经广泛调查研究，认真总结实践经验，参考有关国际标准和国外先进标准，并在广泛征求意见的基础上，修订本规范。本规范的主要技术内容是：总则；术语；基地和总平面；建筑设计；文献资料防护；防火设计；室内环境；建筑设备。本规范修订的主要技术内容是：1.修改适用范围，删除了不适用的规定；2.增加并修改部分术语；3.增加无障碍设计的有关内容；4.补充图书馆部分新的功能空间；5.补充、修改防火的相关内容；6.增加室内环境的有关内容及规定；7.增加智能化和节能的有关内容及规定；8.对部分技术经济指标进行修订。本规范中以黑体字标志的条文为强制性条文，必须严格执行。本规范由住房和城乡建设部负责管理和对强制性条文的解释，由中国建筑西北设计研究院有限公司负责具体技术内容的解释。执行过程中如有意见或建议，请寄送中国建筑西北设计研究院有限公司(地址：陕西省西安市文景路中段98号，邮编：710018)。本规范主编单位：中国建筑西北设计研究院有限公司本规范参编单位：清华大学建筑学院东南大学建筑学院国家图书馆上海图书馆陕西省图书馆本规范主要起草人员：李建广许懋彦孙一钢季伟张涓笑本规范主要审查人员：鲍家声倪欣王宗存赵元超马晓东刘绍周张昕龚恺鲍莉程慕伊徐大平王研赵民杨德才王国光崔彤殷波田策邓军张欧张文才目次1总则	12术语	23基地和总平面	43.1基地	43.2总平面	44建筑设计	54.1一般规定	54.2书库	54.3阅览室(区)	74.4检索和出纳空间	84.5公共活动和辅助服务空间	104.6行政办公、业务及技术设备用房	115文献资料防护	145.1一般规定	145.2温湿度要求	145.3防水和防潮	145.4防尘和防污染	145.5防日光直射和紫外线照射	155.6防磁和防静电	155.7防虫和防鼠	155.8安全防范	156防火设计	176.1耐火等级	176.2防火分区及建筑构造	176.3消防设施	186.4安全疏散	187室内环境	197.1一般规定	197.2室内光环境	197.3室内声环境	208建筑设备	218.1给水排水	218.2采暖、通风与空气调节	218.3电气	248.4建筑智能化	26附录A书库容书量设计估算指标	28附录B阅览室每座占使用面积设计计算指标	29本规范用词说明	30引用标准名录	31附：条文说明	33Contents1GeneralProvisions	12Terms	23SiteSelectionandGeneralLayout	43.1SiteSelection	43.2GeneralLayout	44ArchitecturalDesign	54.1GeneralRequirements	54.2StackRoom	54.3ReadingRoomorViewingAreas	74.4CatalogueRetrievalandCashierAreas	84.5PublicActivitiesandAncillaryServicesAreas	104.6AdminstrativeOfficesandWorkAreasClosedtoPublic	115LiteraturalCollectionPreservation	145.1GeneralRequirements	145.2RequirementsofTemperatureandHumidity	145.3ProtectionAgainstMoistureandWater	145.4ProtectionAgainstPollutionandDust	145.5ProtectionAgainstSunlightandUltravioletRays	155.6ProtectionAgainstStaticElectricityandMagnetic	155.7PestControl	155.8SaftyPrecautions	156FirePrevention	176.1FireresistantLevel	176.2FireControlDistrictandBuildingConstruction	176.3FireControlFacilities	186.4SaftyEvacuation	187IndoorEnvironment	197.1GeneralRequirements	197.2IndoorLightEnvironment	197.3IndoorAcousticEnvironment	208BuildingService	218.1WaterSupplyandDrainage	218.2HeatingVentilationandAirConditioning	218.3BuildingElectrical	248.4BuildingIntelligent	26AppendixAEstimatedIndicatorsofCapacityPesignforStackRoom	28AppendixBIndicatorsforeachSeatOccupiedtheUseoftheReadingRoom	29ExplanationofWordinginThisCode	30ListofQuotedStandards	31Addition:ExplanationofProvisions	331总则"
1,1.0.1,"为保证图书馆建筑的设计质量，使其符合适用、安全、卫生、节能等基本要求，制定本规范。本规范是在《图书馆建筑设计规范》JGJ38-99(以下简称原规范)的基础上修订的，为保证图书馆建筑符合使用、安全、卫生、技术、经济等方面的基本要求，阐明本规范的修订目的，作本条规定。原规范自1999年10月1日实施以来，对指导我国图书馆建筑设计工作，提高设计质量起到了积极作用。但是随着国民经济的迅速发展，图书馆的建设事业也发生了很大变化，主要表现在图书馆管理模式和服务手段等方面，如电子计算机得到广泛应用。电子计算机目录检索逐步取代卡片目录检索，从而成为主要的检索方式。藏阅合一的开架阅览方式受到广大读者的欢迎，空间的开放性要求进一步提高。电子图书与纸质图书同步快速发展，信息载体更加多样化。现代图书馆与传统图书馆相比，由过去“以藏为主”转变为“以用为主”,最大限度的服务于读者，使图书发挥更大的作用。图书馆的功能也在不断拓展，除了其收藏、研究、阅览的基本功能外，学术交流活动、新书展示以及咨询服务等成为图书馆的组成部分。为了适应新时期图书馆建设事业的发展需要，有必要对原规范进行一次全面修订，更好地指导今后的图书馆建筑设计，使图书馆的建筑设计质量不断提高。"
2,1.0.2,本规范适用于新建、扩建和改建的图书馆建筑设计。本条明确本规范的适用范围。图书馆包括公共图书馆、高等学校图书馆、科学研究图书馆及各类专门图书馆等。公共图书馆规定到县级，高等学校图书馆包括大学、学院、专科学校、成人教育学院等配套完整的图书馆。由于图书馆功能的扩展，信息载体的日新月异和人们获取手段的多样化，势必会出现全新概念的图书馆，而本规范针对的对象仍以纸质图书为主要知识信息载体。
3,1.0.3,图书馆建筑应满足文献资料信息的采集、加工、利用和安全防护等要求，并应为读者、工作人员创造良好的环境和工作条件。、1.0.4这两条对图书馆建筑设计的指导思想作出原则性规定。即强调图书馆建筑设计，首先要满足图书馆的功能要求，即文献资料信息的采集、加工、利用和安全防护的功能要求；为读者、工作人员创造良好的环境和工作条件。同时还应结合图书馆的性质和特点及发展趋势，为运用先进的管理模式、现代化的服务手段提供灵活性强、适应性高的空间，并力求造型美观，与环境协调，突出以“读者为主，服务第一”的设计原则。3基地和总平面3.1基地
4,1.0.4,图书馆建筑设计应结合图书馆的性质、特点及发展趋势，并应适应现代化服务、管理的要求，美观大方，与环境协调。
5,1.0.5,图书馆建筑设计除应符合本规范外，尚应符合国家现行有关标准的规定。2术语
6,2.0.1,图书馆library以收集、整理、保管、研究和利用书刊资料、多媒体资料等为主要功能，以借阅方式为主并可提供信息咨询、培训、学术交流等服务的文化建筑。
7,2.0.2,普通阅览室generalreadingroom以书刊为主要信息载体、供普通读者使用的阅览室。
8,2.0.3,特种阅览室specialreadingroom为读者提供音像视听、缩微阅览、电子阅览等特种阅览方式的阅览室。
9,2.0.4,开架阅览室openstackreadingroom阅览和藏书在同一空间中，读者可以自行取阅图书资料的阅览室。
10,2.0.5,文献资料documentliterature记录知识和信息的一切载体，包括书刊资料和非书刊资料。非书刊资料包括音像资料、数字资源等。
11,2.0.6,基本书库basicstackrooms图书馆的主要藏书区，又称基藏书库。
12,2.0.7,特藏书库specialstacks收藏珍善本图书及重要的电子文献资料、音像资料等，对保存条件有特殊要求的库房。
13,2.0.8,珍善本书库rarebookstacks收藏经鉴定列为国家或地方级珍贵文献、对安全防范和保存条件有特殊要求的库房，是特藏书库的一种。
14,2.0.9,开架书库openstacks允许读者入库查找资料并就近阅览的书库。
15,2.0.10,密集书架compactbookshelf若干书架安装在固定轨道上，紧密排列，没有行距，利用电动或手动装置，使任何两行紧密相邻的书架沿轨道分离的专门书架。
16,2.0.11,密集书库compactstacks采用密集书架存放书刊资料、多媒体资料的书库。
17,2.0.12,积层书架stack-systemshelf重叠组合而成，并附有梯子上下的多层固定钢书架。
18,2.0.13,书架层stacklayer书库内的两个结构层之间采用多层书架时，划分每层书架的层面，又称甲板层或软层。
19,2.0.14,档数quantityofstandardbookshelves沿书架长度方向连续布置的标准书架个数。
20,2.0.15,行道aisle两排书架之间的距离，又称书架通道。
21,2.0.16,书刊提升设备booksandperiodicalsascensionequipment为减轻工作人员劳动强度，提高传递速度，设于书库或藏书区的上、下楼层之间，用于传递图书的设备。
22,2.0.17,典藏室book-keepingdepartment图书馆内部登记文献资料移动情况、统计全馆收藏量的专业部门。
23,2.0.18,在线公共目录查询系统onlinepublicaccesscatalogue图书馆提供给广大读者通过网络系统对本图书馆内书刊资料、多媒体资料等相关信息及读者的外借信息进行查询的公用系统。
24,2.0.19,信息处理用房informationprocessingroom用于信息的显示、拍摄、扫描、数据转换、数据传递、数据存储、识别等加工和处理的用房。
25,2.0.20,系统网络机房equipmentroomofcomputersystem&.network由安放计算机、通信设备、控制设备及配套设备的主机房、基本工作间、辅助用房等组成的机房。3基地和总平面3.1基地
26,3.1.1,图书馆基地的选择应满足当地总体规划的要求。对于图书馆基地的选择，公共图书馆需符合当地的城市总体规划要求，大专院校的图书馆，则需服从于校园的总体规划。因为，已批准的城市总体规划或校园总体规划具有一定的法律效力，其规划内容已对交通、环境、市政等重大因素作了周密的分析和考虑，服从总体规划的要求，以保证图书馆建筑与其所处的环境协调统一。
27,3.1.2,图书馆的基地应选择位置适中、交通方便、环境安静、工程地质及水文地质条件较有利的地段。图书馆基地的选择对于图书馆建馆是否成功起着至关重要的作用。因此，选择基地时，需综合各种因素、周密考虑、正确决策，选择地理位置适中、交通便利、环境相对安静、工程地质及水文地质等自然条件和市政设施条件较为有利的地段。
28,3.1.3,图书馆基地与易燃易爆、噪声和散发有害气体、强电磁波干扰等污染源之间的距离，应符合国家现行有关安全、消防、卫生、环境保护等标准的规定。环境污染已成为当今十分突出的问题。国家对此非常重视，已颁布了多项法规。图书馆作为公共文化建筑，人流量较大，人员相对集中，馆藏珍贵，是对环境质量要求较高的公共活动场所，不允许发生火灾、爆炸或受到粉尘、大气污染、强电磁波干扰等。因此，基地的选择需远离各种污染源及易燃易爆场所，按照有关法规，满足防护距离的要求。
29,3.1.4,图书馆宜独立建造。当与其他建筑合建时，应满足图书馆的使用功能和环境要求，并宜单独设置出入口。3.2总平面各类图书馆原则上单独建造为好。据了解全国各地也有一些图书馆是与其他类别的建筑合并建造的情况，将使用性质相近的建筑组合建造也是一种可行的方式。3.2总平面
30,3.2.1,图书馆建筑的总平面布置应总体布局合理、功能分区明确、各区联系方便、互不干扰，并宜留有发展用地。图书馆的功能分区明确、布局合理是总平面布置的一项基本原则。通过合理布局，使图书馆各功能区形成相对独立的区域，同时，保持相互之间的方便联系。考虑到国家节地的政策以及图书馆不断发展和变化的需求，故对总平面布置留有发展余地提出要求。
31,3.2.2,图书馆建筑的交通组织应做到人、书、车分流，道路布置应便于读者、工作人员进出及安全疏散，便于图书运送和装卸。
32,3.2.3,当图书馆设有少年儿童阅览区时，少年儿童阅览区宜设置单独的对外出入口和室外活动场地。为避免互相干扰，并考虑到少儿读者的特点，故要求在条件许可时单独设出入口及室外活动场地。
33,3.2.4,除当地规划部门有专门的规定外，新建公共图书馆的建筑密度不宜大于40%。图书馆要求有良好的室外环境，必要的绿化、道路、停车等室外用地，因此建筑密度不宜过高，新建公共图书馆的建筑密度最好能控制在40%以下。
34,3.2.5,除当地有统筹建设的停车场或停车库外，图书馆建筑基地内应设置供读者和工作人员使用的机动车停车库或停车场地以及非机动车停放场地。目前，我国大中型城市机动车数量迅速增加，停车难的问题日益突出，停车问题亟待解决。其停车的数量和位置应按当地有关部门的规定执行；当无相关规定时，应按实际需要进行测算，合理确定停车数量。
35,3.2.6,图书馆基地内的绿地率应满足当地规划部门的要求，并不宜小于30%。4建筑设计4.1一般规定环境绿化是提高图书馆建筑环境质量的重要组成部分，需根据基地的情况、图书馆建筑性质和所在地区气候特点做好绿化设计。绿化布置和树种选择需要有利于美化环境、净化空气和阻隔噪声，营造安静、优美、卫生的良好环境。4建筑设计4.1一般规定
36,4.1.1,图书馆建筑设计应根据其性质、规模和功能，分别设置藏书、阅览、检索出纳、公共活动、辅助服务、行政办公、业务及技术设备用房等。
37,4.1.2,图书馆建筑布局应与其管理方式和服务手段相适应，并应合理安排采编、收藏、借还、阅览之间的运行路线，使读者、管理人员和书刊运送路线便捷畅通，互不干扰。图书馆是功能性较强的民用建筑之一，建筑布局需与管理模式、服务手段相适应，合理安排采编、收藏、外借、阅览之间的运行路线，使读者、管理人员和书刊运送路线便捷畅通，互不干扰。建筑设计需与图书馆管理密切配合，从使用功能上提出符合本馆实际、切实可行的管理模式和服务手段，合理安排各部门间的关系和日常工作流程。
38,4.1.3,图书馆藏阅空间的柱网尺寸、层高、荷载设计应有较大的适应性和使用的灵活性。各类图书馆随着管理模式的改变，服务手段的不断完善和现代化，对图书馆的建筑空间要求有较大的灵活性和适应性，以满足功能调整变化的需要。开架管理逐步扩大，要求藏阅合一的综合空间越来越多，出现了柱网、层高、荷载统一的做法，即所谓“三统一”。因此，在确定图书馆藏阅空间的柱网、层高和荷载时，需要从灵活性方面多加考虑，综合分析，慎重确定。对于功能相对稳定的空间，如办公、会议室，内部业务用房，则按实际使用要求确定其柱网尺寸和层高，按结构荷载规范中的规定选用荷载。
39,4.1.4,"图书馆的四层及四层以上设有阅览室时，应设置为读者服务的电梯，并应至少设一台无障碍电梯。四层及四层以上的阅览室用电梯作为垂直交通工具，目前已经成为共识。有的馆还为读者安装了自动扶梯。“读者为主、服务第一”,为读者提供方便的阅览条件，提高图书馆的效率，同时便于老年人、残障人员使用。4.2书库"
40,4.1.5,图书馆建筑应进行无障碍设计，并应符合现行国家标准《无障碍设计规范》GB50763的规定。
41,4.1.6,图书馆建筑应进行节能设计，并应符合现行国家标准《公共建筑节能设计标准》GB50189的规定。4.2书库
42,4.2.1,图书馆的书库包括基本书库、开架书库、特藏书库等形式。图书馆建筑设计可根据具体情况选择书库形式。图书馆事业在不断的发展，开架管理已成为主要的管理模式。在这种形势下，要求把最近、最新、参考性最强的常用书放在相关的书库内施行开架管理，由读者自行取阅。为了节约藏书面积，通常将一些流通量很低的呆滞书放入密集书库。密集书库由于荷载较大，最好安排在建筑的下层部位。
43,4.2.2,基本书库的结构形式和柱网尺寸应适合所采用的管理方式和所选书架的排列要求。图书馆书库的结构形式虽有多种多样，但常用柱网尺寸按1.20m或1.25m的倍数，多为7.20m×7.20m或7.50m×7.50m。结构体系经济合理，并能较好满足使用要求。其他柱网尺寸也可以根据实际情况采用。
44,4.2.3,图书馆书库容书量设计估算指标应符合本规范附录A的规定。藏书量的计算是确定书库大小的依据。设计时，可以按开架、闭架管理形式，每标准书架的藏书量和单位使用面积的容书架量两个指标，确定的管理模式，对照选用，作出较准确的估算。
45,4.2.4,"书库的平面布局和书架排列应有利于天然采光和自然通风，并应缩短书刊取送距离；书架的连续排列最多档数应符合表-1的规定，书架之间以及书架与墙体之间通道的最小宽度应符合表4.2.4-2的规定。表4.2.4-1书库书架连续排列最多档数(档)条件开架闭架书架两端有走道911书架一端有走道56表4.2.4-2书架之间以及书架与墙体之间通道的最小宽度(m)通道名称常用书架不常用书架开架闭架主通道1.501.201.00次通道1.100.750.60档头走道(即靠墙走道)0.750.600.60行道1.000.750.60书库柱网尺寸的确定是以平面布局设计的书架排列为依据的。而书架排列以有利于通风、采光、方便查书、上架、提书、运书、防火、疏散以及入库阅览等为原则。在满足这些条件之下，争取最大的藏书容量。表4.2.4-1提出书架在不同情况下的排列长度(按书架档数计),也是控制提书距离的一项必要措施。表4.2.4-2规定了书架排列的最小净距离和库内主、次通道，靠墙一侧的档头走道等的最小宽度。"
46,4.2.5,"书架宜垂直于开窗的外墙布置。书库采用竖向条形窗时，窗口应正对行道，书架档头可靠墙。书库采用横向条形窗且窗宽大于书架之间的行道宽度时，书架档头不应靠墙，书架与外墙之间应留有通道，其尺寸应符合本规范表4.2.4-2的规定。在基本书库设计中，外墙开窗常采用对正各条书架行道的做法。行道净宽通常为0.80m,故窗宽也只能限定在0.80m以内。有时为了扩大采光效果进一步把窗台降低，构成狭长的条形窗，也是一种常见的开窗方式。开架阅览及开架书库采用大窗或横向带形窗时，书架与外墙之间留出档头走道，即书架档头不直接紧靠外窗，以避免藏书受到日晒或雨淋，以及给开窗、关窗造成不便或对防盗安全及室外观瞻不利。"
47,4.2.6,特藏书库应单独设置。珍善本书库的出入口应设置缓冲间，并在其两侧分别设置密闭门。珍善本书库主要收藏刻本、写本、稿本、拓本、书画等古籍与珍品，收藏经鉴定列为国家或地方级的珍贵文献，其保存条件对环境变化有更高的要求，当温、湿度突然变化时，易发生损害。因此，珍善本书库与其相邻房间之间的出入口需设置缓冲间，并分别在缓冲间两侧各设一道密闭门。
48,4.2.7,卫生间、开水间或其他经常有积水的场所不应设置在书库内部及其直接上方。
49,4.2.8,"书库的净高不应小于2.40m。有梁或管线的部位，其底面净高不宜小于2.30m。采用积层书架的书库，结构梁或管线的底面净高不应小于4.70m。书库(包括开架阅览的固定藏书区)的净高是按空间尺度、采光、卫生、心理等因素确定的。通常积层书架下层高2.40m,上层高2.15m,书架层板厚0.05m,故采用积层书架的书库净高按4.70m考虑。"
50,4.2.9,"书库内的工作人员专用楼梯的梯段净宽不宜小于0.80m,坡度不应大于45°,并应采取防滑措施。为了便于库内工作人员提书、归书的方便及安全而提出的相关技术要求。"
51,4.2.10,二层至五层的书库应设置书刊提升设备，六层及六层以上的书库应设专用货梯。
52,4.2.11,"书刊提升设备的位置宜邻近书刊出纳台。书库提升设备一般设在书库与出纳台相邻的适当位置，使之既便于采编部门把加工好的新书成批地运送入书库(或通过典藏室入库),又便于日常提书、归书的上下运输。"
53,4.2.12,同层的书库与阅览区的楼、地面宜采用同一标高。规定书库与阅览区楼地面采用同一标高，目的是为了保证水平运书的通畅。4.3阅览室(区)
54,4.2.13,书库荷载值的选择，应根据藏书形式和具体使用要求按现行国家标准《建筑结构荷载规范》GB50009确定。4.3阅览室(区)
55,4.3.1,图书馆应按其性质、任务及不同的读者对象设置相应的阅览室或阅览区。
56,4.3.2,阅览室(区)应光线充足、照度均匀。阅览室(区)域采光既要充足，又不能过强，且要均匀，不产生光影和暗角，平面布置中应争取阅览室有良好的朝向。
57,4.3.3,阅览室(区)的开间、进深及层高，应满足家具、设备的布置及开架阅览的使用和管理要求。由于阅览室(区)常采用开架方式，兼顾阅览和藏书两种不同的功能，故需对阅览空间的家具设备进行排列，找出通用、灵活的开间和进深尺寸。
58,4.3.4,阅览室(区)应根据管理模式在入口附近设置相应的管理设施。
59,4.3.5,阅览桌椅排列的最小间距应符合表4.3.5的规定。表4.3.5阅览桌椅排列的最小间距(m)条件最小间距尺寸备注开架闭架单面阅览桌前后间隔净宽0.650.65适用于单人桌、双人桌双面阅览桌前后间隔净宽1.30~1.501.30~1.50四人桌取下限六人桌取上限阅览桌左右间隔净宽0.900.90阅览桌之间的主通道净宽1.501.20阅览桌后侧与侧墙之间净距靠墙无书架时1.05靠墙书架深度按0.25m计算靠墙有书架时1.60阅览桌侧沿与侧墙之间净距靠墙无书架时0.60靠墙书架深度按0.25m计算靠墙有书架时1.30阅览桌与出纳台外沿净宽单面桌前沿1.851.85单面桌后沿2.502.50双面桌前沿2.802.80双面桌后沿2.802.80表4.3.5按照静止和活动状态下的人体尺度列出阅览桌椅排列间隔及各类通道最小宽度，作为阅览室的设计要求。
60,4.3.6,珍善本阅览室与珍善本书库应毗邻布置。
61,4.3.7,舆图阅览室应能容纳大型阅览桌，并应有完整的大片墙面和悬挂大幅舆图的设施。由于舆图有的篇幅很大，阅览室至少需备有一张大舆图台，舆图台的尺寸约2.80m(长)×1.60m(宽)×0.80m(高)。除此之外还需留出整片墙面和悬挂舆图的固定设施。
62,4.3.8,缩微阅读应设专门的阅览区，并宜与缩微资料库相连通，其室内家具设施应满足缩微阅读的要求。
63,4.3.9,音像视听室由视听室、控制室和工作间组成，并宜自成区域。由于视听室是通过直观手段(听觉或视觉)以图像和电声表达的，自身要求安静，同时要求不影响其他阅览用房，故所在位置应和一般阅览区有一定的分隔.
64,4.3.10,珍善本书、舆图、音像资料和电子阅览室的外窗均应有遮光设施。
65,4.3.11,少年儿童阅览室应与成人阅览区分隔。图书馆附设少年儿童阅览室时，除留出必要的工作联系通道外，需与成人阅览区进行分隔，以免相互干扰。
66,4.3.12,视障阅览室应方便视障读者使用，并应与盲文书库相连通。
