,flag,node
127,6.2.4,阅览室及藏阅合一的开架阅览室均应按阅览室功能划分其防火分区。藏阅合一的开架阅览空间模式在目前图书馆建设中被广泛采用。原规范规定此种空间按书库划分防火分区，使防火分区面积划分过小，难以适应现代图书馆的功能需要。设计单位及使用单位对此反应强烈，要求适当放宽藏阅合一空间的防火分区限制范围。因此，本规范编制组在大量调研的基础上，达成以下共识：①藏阅合一的阅览空间是在阅览室存放相当数量的图书资料，火灾荷载增大；②阅览室的部分空间被书架占用，容纳的读者数量相应减少；③开架阅览空间中所存放的图书资料多为流通性较强的资料，不同于特藏文献珍贵重要，造成的火灾损失相对较小；④较为开敞的空间形式能更好的适应目前我国图书馆建设的发展需要。综合以上因素，本规范编制组认为对图书馆内藏阅合一的阅览空间，其防火分区面积的划分可不按书库进行划分，而按阅览室划分相应的防火分区。6.3消防设施
128,6.2.5,对于采用积层书架的书库，其防火分区面积应按书架层的面积合并计算。
129,6.2.6,除电梯外，书库内部提升设备的井道井壁应为耐火极限不低于2.00h的不燃烧体，井壁上的传递洞口应安装不低于乙级的防火闸门。
130,6.2.7,图书馆的室内装修应符合现行国家标准《建筑内部装修设计防火规范》GB50222的有关规定。6.3消防设施
131,6.3.1,藏书量超过100万册的图书馆、建筑高度超过24m的书库以及特藏书库，均应设置火灾自动报警系统。本条根据现行国家标准《建筑设计防火规范》GB50016关于设置火灾自动报警系统的规定拟定。
132,6.3.2,图书馆的室内消火栓箱宜增设消防软管卷盘。
133,6.3.3,建筑灭火器配置应符合现行国家标准《建筑灭火器配置设计规范》GB50140的有关规定。
134,6.3.4,特藏书库、系统网络机房和贵重设备等用房应设置自动灭火系统，其中不适合用水扑救的场所宜选用气体灭火系统。6.4安全疏散本条根据现行国家标准《建筑设计防火规范》GB50016关于设置气体灭火系统的规定拟定。6.4安全疏散
135,6.4.1,图书馆每层的安全出口不应少于两个，并应分散布置。~
136,6.4.2,书库的每个防火分区安全出口不应少于两个，但符合下列条件之一时，可设一个安全出口：1占地面积不超过300m²的多层书库；2建筑面积不超过100m²的地下、半地下书库。
137,6.4.3,建筑面积不超过100m²的特藏书库，可设一个疏散门，并应为甲级防火门。
138,6.4.4,当公共阅览室只设一个疏散门时，其净宽度不应小于1.20m。
139,6.4.5,书库的疏散楼梯宜设置在书库门附近。
140,6.4.6,图书馆需要控制人员随意出入的疏散门，可设置门禁系统，但在发生紧急情况时，应有易于从内部开启的装置，并应在显著位置设置标识和使用提示。7室内环境7.1一般规定本节各条规定均根据现行国家标准《建筑设计防火规范》GB50016的相关内容拟定。7室内环境7.1一般规定
141,7.1.1,图书馆建筑应充分利用自然条件，采用天然采光和自然通风。图书馆的使用特点是读者集中，开放时间长，照明、空调及设备用电量大。设计应尽量利用天然采光和自然通风，达到节能的目的。7.2室内光环境
142,7.1.2,图书馆建筑室内环境污染物浓度限量应符合现行国家标准《民用建筑工程室内环境污染控制规范》GB50325的规定。7.2室内光环境
143,7.2.1,图书馆各类用房或场所的天然采光标准值不应小于表7.2.1中的规定。表7.2.1图书馆各类用房或场所的天然采光标准值用房或场所采光等级侧面采光顶部采光采光系数标准值(%)天然光照度标准值(Ix)窗地面积比(Ae/Ad)采光系数标准值(%)天然光照度标准值(lx)窗地面积比(As/Ad)阅览室、开架书库、行政办公、会议室、业务用房、咨询服务、研究室Ⅲ34501/523001/10检索空间、陈列厅、特种阅览室、报告厅IV23001/611501/13基本书库、走廊、楼梯间、卫生间V11501/100.5751/23表7.2.1的内容摘自现行国家标准《建筑采光设计标准》GB50033的有关规定，以Ⅲ类光气候区为参照。图书馆的各类用房的天然采光标准不应低于表中的规定。有些阅览室进深过大，不能满足标准要求时，可考虑用局部人工照明加以补充。7.3室内声环境
144,7.2.2,图书馆各类用房或场所的人工照明设计应符合本规范第8.3.5条有关规定。7.3室内声环境
145,7.3.1,图书馆各类用房或场所的噪声级分区及允许噪声级应符合表7.3.1的规定。表7.3.1图书馆各类用房或场所的噪声级分区及允许噪声级噪声级分区用房或场所允许噪声级(A声级，dB)静区研究室、缩微阅览室、珍善本阅览室、舆图阅览室、普通阅览室、报刊阅览室40较静区少年儿童阅览室、电子阅览室、视听室、办公室45闹区陈列室、读者休息区、目录室、咨询服务、门厅、卫生间、走廊及其他公共活动区50图书馆建筑要求使用环境安静，除在选址中予以考虑外，建筑平面布置时，宜根据各类用房允许噪声级分区布置。表7.3.1参照现行国家标准《民用建筑隔声设计规范》GB50118进行拟定。8建筑设备8.1给水排水
146,7.3.2,电梯井道及产生噪声和振动的设备用房不宜与有安静要求的场所毗邻，否则应采取隔声、减振措施。8建筑设备8.1给水排水
147,8.1.1,图书馆应设室内外给水排水系统和消防给水系统及相应的设施和设备。消防给水系统及相应的设施和设备，指与之配套的消防水池、泵房、室外水泵接合器等。设计可根据图书馆的规模及城市公用设施的情况，具体设计确定。
148,8.1.2,珍善本书库不应有水管进入。除消防给水管道外，其他书库及开架阅览室内不应有给排水管道穿过，排水立管不宜安装在与书库相邻的内墙上。珍善本书库藏有珍贵的孤本、线装书等珍贵书籍，一旦遇水会有很大损失并难以复原。其他书库除必要的消防给水管道外，也不应有给排水管道穿过。
149,8.1.3,屋面雨水管道宜采用外排水；当采用内排水时，雨水管道应采取防渗漏措施。屋面雨水应尽量采取外排水形式，当采用内排水时，雨水管材及接口应采用安全性高的产品，如热熔、焊接等连接方式。
150,8.1.4,缩微照相用房的排水管道应耐酸、碱腐蚀，室外应设污水处理设施。微缩底片在冲洗过程中使用的显影剂是酸性溶液，定影剂又属于碱性溶液，对金属管道及金属配件均有腐蚀作用。设计中应考虑上述管道及配件的防腐蚀措施。微缩量大的图书馆，应在微缩复制冲洗间室外设置污水处理设施。8.2采暖、通风与空气调节
151,8.1.5,水泵等供水设备应采取减振、降噪措施。8.2采暖、通风与空气调节
152,8.2.1,"图书馆设置集中采暖或空气调节系统时，室内温度、湿度设计参数宜分别符合表8.2.1-1及表8.2.1-2的规定。表8.2.1-1图书馆集中采暖系统室内温度设计参数房间名称室内温度(℃房间名称室内温度(℃)少年儿童阅览室20会议室18普通阅览室报告厅(多功能厅)舆图阅览室装裱、修整室缩微阅览室复印室电子阅览室门厅16开架阅览室、开架书库走廊视听室楼梯间研究室卫生间内部业务办公室基本书库14目录、出纳厅(室)特藏书库读者休息室陈列室表8.2.1-2图书馆空气调节系统室内设计参数房间名称感光层干球温度(℃)相对湿度(%)风速(m/s)冬夏冬夏冬夏特藏书库珍善本书库14～2445～60-—缩微胶卷胶片及照片长期(100年以上)保存银-明胶型干银微泡重氮≤21≤15≤1020～3020～4020～50中期(10年以上)保存≤2520～50长期(100年以上)保存彩色≤-3≤-1020～3020～4020～50中期(10年以上)保存彩色≤2520～50唱片、光盘库15～2025～45-———少年儿童阅览室18～2025～2730～6040～65<0.2<0.3普通阅览室18～2025～2730～6040～65<0.2<0.3缩微阅览室——18～2024～2730～6040～65<0.2<0.3电子阅览室18～2025～2730～6040～65<0.2<0.3开架阅览室、开架书库18～2025～2730～6040～65<0.2<0.3基本书库≥14≤2830～6040～65<0.2<0.3视听室18～2025～2730～6040～65<0.2<0.3报告厅18～2024～2730～6040～65<0.2<0.3会议室16～1825～2730～6040～65<0.2<0.3目录、出纳厅(室)18～2025～2730～6040～65<0.2<0.3研究室18～2025～2730～6040～65<0.2<0.3内部业务办公室18～2025～2730～6040～65<0.2<0.3装裱、修整室18～2025～2730～6040～65<0.2<0.3美工室18～2025～2730～6040～65<0.2<0.3公共活动空间18～2025～2730～6040～65<0.2<0.3随着图书馆缩微技术的应用，缩微胶片保存量越来越多，而保存缩微品环境的温、湿度及其变化，对缩微品保存寿命有很大的影响，特别是湿度对缩微品的影响更大，湿度是引发文物档案劣化的主要物理因素。因此，特藏书库的空调系统设计应首要考虑湿度，以“湿度优先”调控。本次修订缩微品储存环境要求按现行行业标准《档案缩微品保管规范》DA/T21的规定作了调整。缩微品的保存除温、湿度要求外，还对空气净化、防火、防水以及防光等都有要求，本规范不一一列出，设计时应参考相应规范、标准。依据现行国家标准《公共建筑节能设计标准》GB50189,图书馆内各种用房集中采暖室内计算温度作了适当调整。"
153,8.2.2,"图书馆主要用房和空间的设计新风量应符合表8.2.2的规定。表8.2.2图书馆主要用房和空间的设计新风量房间名称新风量[m3/(h·p)]房间名称新风量[m3/(h·p)]开架书库10目录、出纳厅(室)10陈列室门厅珍善本、舆图阅览室普通阅览室缩微阅览室电子阅览室开架阅览室视听室30报告厅(多功能厅)30会议室内部业务办公室读者休息室装裱、修整室研究室注：报告厅和会议室一般出现最多人数的持续时间少于3h,所需新风量按室内平均人数确定，该平均人数不应少于最多人数的1/2。新风量大小与能耗、初投资和运行费等密切相关，而且关系到人体健康。本规范给出的新风量标准依据现行国家标准《公共建筑节能设计标准》GB50189,并综合考虑图书馆的功能特点。"
154,8.2.3,"基本书库的温度不宜低于5℃且不宜高于30℃;相对湿度不宜小于30%且不宜大于65%。单就有利于书刊资料保护而言，基本书库在不设空调的情况下，温湿度以低些为好，但要适度，否则有使纸张水分冻结而易受损的可能。另外还考虑到工作人员身体健康的承受能力等因素，因此确定温度下限为5℃。高温(库房温度在30℃以上)对图书的危害尤为严重。其主要表现为：温度过高，会使纸张中原有的水分迅速蒸发而干燥发脆，抗折性和其他机械强度降低，加速纸张老化。因此温度上限宜为30℃。书库内标准温、湿度的设定主要依据是：要有利于文献资料保存的耐久性，不利于有害生物(包括图书害虫、书库霉菌和家鼠)的生长和繁殖。近年来，图书馆书籍的更新时间趋向加快，同时冬季采暖时要保证较高的相对湿度设计难度较大。因此对于书库内书籍的长期保存相对湿度要求，其下限标准由原来的40%调整到30%,上限仍为65%。当超越上述限定时，应通过热工计算首先考虑采取建筑隔热、保温措施，其次再以空调设备手段进行解决。"
155,8.2.4,"特藏书库储存环境的温度、湿度应相对稳定，24h内温度变化不应大于士2℃,相对湿度变化不应大于士5%。与特藏书库毗邻的特藏阅览室，温度差不宜超过士2℃,相对湿度差不宜超过±10%。特藏书库保存环境温、湿度控制的关键是“平稳”,即主要在于温、湿度的波动。温、湿度的波动上、下限控制指标实际要比具体的温、湿度值更重要，是特藏书库保存必须考虑的设计参数。例如，缩微胶片、磁带等非书资料，当环境的温、湿度突然变化时，将发生涂层脱落、开裂或粘连。因此，与之毗连的特藏阅览室温湿度变化应有一定要求。本条文依据现行行业标准《档案缩微品保管规范》DA/T21和《博物馆建筑设计规范》JGJ66对原条文作了修改。"
156,8.2.5,图书馆内的系统网络机房温度、湿度参数及其他设计要求应符合现行国家标准《电子信息系统机房设计规范》GB50174的规定。
157,8.2.6,采暖、空调系统应根据图书馆的性质及使用功能进行分区和设置。图书馆使用时间长，耗能高，而内部功能多，从节能角度出发，采暖、空调系统宜根据图书馆类型和使用功能分区并合理划分系统和设置系统，便于各个房间和空间灵活调节，根据使用要求开启或关闭采暖、空调系统，增强调节性。例如：大型图书馆有特藏书库和珍善本书库，对环境要求较高，需要设置单独的空调系统。对于书库，尤其是密集书库，一般无人进入，对温度要求不是很高，但对湿度有一定要求，在单独设置温、湿度系统后调节灵活，不受其他房间约束。对于标准不是很高的中小型图书馆根据实际仅需要设置采暖系统，但对于内部标准要求较高的报告厅和电子阅览室，又需要单独设置空调系统。此外对于功能和用处差别较大的公共图书馆、高校图书馆以及各类专门图书馆，除了考虑图书馆规模外，还应按实际需求设置采暖或空调系统。
158,8.2.7,"书库设置集中采暖时，热媒宜采用不超过95℃的热水，管道及散热器应采取可靠措施，严禁渗漏。从防护安全出发对集中采暖的热媒温度规定为：热水采暖不超过130℃,蒸气采暖不超过110℃。由于图书馆是人员集中学习的场所，从卫生条件考虑热媒宜采用温度不超过100℃的热水采暖系统为妥。图书馆的采暖系统要求管道无漏水，尤其是书库更不允许漏水现象发生。例如采用焊接代替丝扣连接、采用严密性较好的散热器等比较可靠。在条件允许的情况下采用热风采暖更好。"
159,8.2.8,特藏书库、系统网络主机房的空调设备宜单独设置机房，当不具备条件时，空调设备应具有漏水检测报警等功能。特藏书库、系统网络主机房的空调设备建议单独设置机房，当其规模较小，或确实因条件限制需放置在一个空间内时，其空调设备应具备漏水检测报警等安全功能。
160,8.2.9,特藏书库空气调节设备不宜少于2台，当其中一台停止工作时，其余空调设备的负荷宜满足总负荷的80%。保证特藏书库的室内环境安全。
161,8.2.10,通风、空气调节系统的风管在进出各类书库时，应设置防火阀。
162,8.2.11,空气调节系统宜兼备机械通风换气的功能。使用空调能耗较大，因此设计时充分考虑节能要求，尽量减少空调开启时间，充分利用室外新风，机械通风降温。
163,8.2.12,书库应设机械通风设施，且进风口宜设置过滤装置。书库由于层高低，藏品具有蓄热量大和容易吸潮的特点，必须经常保持良好的通风状态，才不致出现发霉、生虫等现象。最好的办法是开窗进行通风对流。但在梅雨季节或潮湿地区，经常开窗会使室外潮湿空气大量入侵，同时在多风沙地区又会造成灰尘进入。因此在外界气候不利的情况下书库又以密闭不开窗，甚至加上密封条盖缝措施为宜。所以书库在一个相当长的时间内需要以机械设备进行通风换气。对于风沙较大和灰尘较多的地区，书库进风口宜设置过滤装置。
164,8.2.13,特藏书库、缩微复制间的通风及空气调节系统应进行净化处理。缩微复制无论在原材料贮存、照相拍片、冲洗烘干，以及封藏保存等各个阶段都不允许受到灰尘和有害气体的侵蚀和污染。灰尘吸附在胶片上能造成胶片划伤，有害气体如二氧化硫、硫化氢、氨基酸性气体等对胶片会起腐蚀作用。未干的油漆气味对胶片的损害也很大，甚至能严重影响制品质量，缩短制品寿命。按现行行业标准《档案缩微品保管规范》DA/T21的规定，应使用过滤装置滤掉输入胶片库空气中的尘埃，同时特藏书库、缩微复制间等应远离化学污染物等有害气体源，当存放场所可能存在化学污染时，应采取相应的过滤或吸收装置将有害气体从空气中除掉。
165,8.2.14,书库、阅览室应保持气流均匀，当采用机械通风时，空气流速不应大于0.5m/s。由于过大的空气流速会造成书刊自动翻页，故在采用机械通风设备时，空气流速限定不得超过0.5m/s。
166,8.2.15,图书馆内各种用房的通风换气设计参数应符合表8.2.15的规定。表8.2.15图书馆内各种用房的通风换气设计参数房间名称通风换气次数(次/h)房间名称通风换气次数(次/h)陈列室1～2缩微阅览室2研究室装裱、修整室目录、出纳厅(室)会议室缩微复制用房书库1～3普通阅览室少年儿童阅览室内部业务用房读者休息室3～5报告厅2复印室5～10视听室消毒室电子阅览室、舆图阅览室卫生间严寒和寒冷地区的图书馆，一般设有集中采暖系统，冬季门窗紧闭，当没有采取建筑措施以满足通风换气要求时，阅览室等人员长期活动的房间宜设机械通风装置。复印室、消毒室和卫生间等场所，要求的通风换气次数较大，应设机械通风。8.3电气
167,8.2.16,通风及空调设备应采取减振降噪措施。8.3电气
168,8.3.1,图书馆建筑用电负荷等级应按下列原则确定：1总藏书量超过100万册图书馆的安防系统、图书检索用计算机系统用电应为一级负荷中特别重要的负荷；2总藏书量10万至100万册图书馆的安防系统、图书检索用计算机系统用电应为一级负荷；3总藏书量10万册以下图书馆的安防系统、图书检索用计算机系统用电应为二级负荷；4图书馆建筑中其他用电负荷应根据建筑规模和重要性按现行行业标准《民用建筑电气设计规范》JGJ16进行确定。总藏书量超过100万册时，基本都属于国家级、省级及重点高等院校的图书馆，其安全防范系统及图书检索用计算机系统的用电应保证其连续性，停电将产生严重后果，故将其定为一级负荷中特别重要的负荷；总藏书量10万至100万册的图书馆，为保证其安全防范系统及图书检索用计算机系统的用电，故定为按一级负荷要求供电，设计人员可根据工程的具体情况，电网情况设置可靠的备用电源；总藏书量不大于10万册的图书馆因其建筑规模小，很少有特藏品，其安全防范系统及图书检索用计算机系统的用电可按二级负荷供电。
169,8.3.2,图书馆内供配电系统应适应不同空间使用功能变化的需要，各功能空间内应预留计算机、视听设备、缩微、复印机等设备的电源接口。图书馆建设初期都不能达到设计藏书量，随着使用时间推移，设备及藏书都会不断增加，藏、借、阅等功能空间可能会发生变化，在某一空间内电子设备，多媒体设备也会增加或变换位置，在设计时应充分考虑这些因素，合理划分供电范围，适当配置配电设备和电源。
170,8.3.3,图书馆公用空间与内部使用空间的照明宜分别配电和控制。图书馆通常设置藏书、借书、阅览、出纳、检索、公共活动及辅助用房，这些属于对读者服务的公用空间；同时还设有行政办公、业务及技术用房、库房、维修间等内部使用空间，为缩小相互影响范围，便于管理，便于核算，照明系统宜分别配电和控制。
171,8.3.4,图书馆应设置正常照明和应急照明，并宜根据需要设置值班照明或警卫照明。图书馆除设置一般照明外，有些场所如陈列室、普通阅览室、专业阅览室、珍善本舆图阅览室，缩微阅览室等处还可设置局部照明，设置局部照明有些是阅览的需要，有的是节能的需要，有些阅览室读者较少时可开少数灯，用局部照明作为补充。图书馆属于公共建筑，在其疏散通道，楼梯间，疏散出口等处设置应急照明是必要的。有的图书馆由于规模大，藏品重要，流动人员多，通常设有完善的安全防护系统，从保卫工作的需要，在重要场所，重要库房等处应设警卫照明，其他区域可设值班照明。
172,8.3.5,图书馆建筑各类用房或场所照明设计标准值应符合表8.3.5的规定。表8.3.5图书馆建筑各类用房或场所照明设计标准值房间或场所参考平面及其高度照度标准值(lx)统一眩光值UGR一般显色指数Ra照明功率密度(W/m²)普通阅览室、少年儿童阅览室0.75m水平面30019809国家、省级图书馆的阅览室0.75m水平面500198015特种阅览室0.75m水平面30019809珍善本阅览室、舆图阅览室0.75m水平面500198015门厅、陈列室、目录厅、出纳厅0.75m水平面30019809续表8.3.5房间或场所参考平面及其高度照度标准值(lx)统一眩光值UGR一般显色指数₈照明功率密度(W/m²)书库0.25m垂直面50——80工作间0.75m水平面30019809典藏间、美工室、研究室0.75m水平面30019809
173,8.3.6,公共区域的照明应采用集中、分区或分组控制的方式，阅览区的照明宜采用分区控制方式。公共区域，阅览区的照明宜根据不同使用要求采取自动控制的节能措施。图书馆的各个区域通常都有工作人员管理，公共区域及阅览室的照明应由工作人员根据人员多少进行分区分片控制，为节能的需要，国家，省市及规模较大的图书馆的照明应根据照度要求、功能要求进行自动控制。
174,8.3.7,书库照明灯具与书刊资料等易燃物的垂直距离不应小于0.50m。当采用荧光灯照明时，珍善本书库及其阅览室应采用隔紫灯具或无紫光源。为了避免珍藏品遭受紫外线的损伤，对珍善本书库及其阅览室所采用灯具及光源作此规定。
175,8.3.8,书库电源总开关箱应设于库外，书库照明宜分区、分架控制。当沿金属书架敷设照明线路及安装照明设备时，应设置剩余电流动作保护措施。沿金属书架敷设的照明线路及照明设备，当绝缘损坏漏电时，金属书架会带电，易造成人员电击事故。
176,8.3.9,书架行道照明应有单独开关控制，行道两端都有通道时应设双控开关；书库内部楼梯照明应采用双控开关。采用双控开关，工作人员管理方便，少走回头路，节约电能。
177,8.3.10,图书馆建筑应采取电气火灾监控措施。图书馆内人员密集，藏有珍贵资料，且书库为丙类库房，火灾危险性大，一旦发生火灾，损失巨大。
178,8.3.11,图书馆建筑内电气配线宜采用低烟无卤阻燃型电线电缆。图书馆建筑为人员密集场所，火灾危险性大，火灾时电气线路燃烧会释放大量烟气及有毒气体，会对现场人员造成伤害。8.4建筑智能化
179,8.3.12,建筑物的防雷与接地设计应符合国家现行标准《建筑物防雷设计规范》GB50057、《建筑物电子信息系统防雷技术规范》GB50343、《民用建筑电气设计规范》JGJ16的规定。8.4建筑智能化
180,8.4.1,图书馆宜根据规模、性质及建设条件进行建筑智能化系统设计，并应符合现行国家标准《智能建筑设计标准》GB50314的规定。
181,8.4.2,图书馆应设置由主干网、局域网、信息点组成的计算机网络系统。信息点的布局应根据阅览座席、业务工作的需要确定。有条件时，可设置局域无线网络系统。由于网络图书馆、电子阅览室以及图书馆采编、管理等需求，在图书馆建设网络化的电子信息系统已经成为图书馆智能化建设的重要组成部分。设置局域无线网络，可以作为有线网络的补充和后备，给读者及工作人员创造更为便利的上网条件。
182,8.4.3,图书馆应设置综合布线系统。综合布线系统宜与电子信息、办公自动化、通信自动化等设施统一设计。综合布线系统是图书馆信息化、网络化、自动化的基础设施。统一设计综合布线系统，有利于各系统兼容，其配线系统也更具适应性和灵活性。
